{
  "$schema": "https://json-schema.org/draft/2020-12/schema",
  "$id": "openmathmodel.contracts.v1.dataset-profile",
  "title": "DatasetProfile",
  "description": "数据准备页正文投影：DATA_PREPARATION 阶段真实 LLM 节点的最新成功输出（run_domain_events 的 STEP_SUCCEEDED）。模拟链或阶段未完成时该投影整体为 null，由 stage-outputs 端点表达。",
  "type": "object",
  "properties": {
    "run_id": { "$ref": "#/$defs/run_id" },
    "profile_summary": {
      "type": "string",
      "description": "一段话的数据画像摘要（数据构成、规模量级、质量状况与可用性结论）。"
    },
    "datasets": {
      "type": "array",
      "items": { "$ref": "#/$defs/dataset_entry" },
      "description": "数据清单；题目未附数据时 source 注明「需收集」或「需构造」。"
    },
    "preparation_steps": {
      "type": "array",
      "items": { "type": "string" },
      "description": "可执行的数据准备步骤，按执行顺序排列。"
    },
    "missing_value_strategy": {
      "type": ["string", "null"],
      "description": "缺失值处理策略与理由；节点未给出时为 null。"
    },
    "outlier_strategy": {
      "type": ["string", "null"],
      "description": "异常值识别与处理策略；节点未给出时为 null。"
    },
    "derived_features": {
      "type": "array",
      "items": { "type": "string" },
      "description": "建议构造的衍生变量（含构造方式）；节点未给出时为空列表。"
    },
    "cleaning": {
      "oneOf": [
        { "type": "null" },
        { "$ref": "#/$defs/cleaning_report" }
      ],
      "description": "清洗脚本的执行结论（沙盒子代理按准备方案清洗 data/ → cleaned/：影响面统计由脚本标记行给出、节点只做除法与求交）与独立审稿结论（生成者-评审者环）。数据节点未产出该字段（该字段出现之前的运行、模拟节点）时为 null；执行被跳过时 executed=false 并给原因。可选字段：旧消费者可忽略。"
    },
    "inputs": {
      "type": "array",
      "items": { "$ref": "#/$defs/data_input" },
      "description": "本次运行下发给数据阶段的原始数据文件（运行参数 attachment_metadata 里的附件，按登记顺序；投影按产物登记表确定性填，不经模型）。没有附件为空列表。可选字段：该字段出现之前的消费者可忽略。"
    },
    "updated_at": { "$ref": "#/$defs/timestamp" }
  },
  "required": [
    "run_id",
    "profile_summary",
    "datasets",
    "preparation_steps",
    "missing_value_strategy",
    "outlier_strategy",
    "derived_features",
    "updated_at"
  ],
  "additionalProperties": false,
  "$defs": {
    "run_id": { "type": "string", "pattern": "^run_[0-9a-f]{32}$" },
    "timestamp": {
      "type": "string",
      "pattern": "^\\d{4}-\\d{2}-\\d{2}T\\d{2}:\\d{2}:\\d{2}(\\.\\d{1,6})?Z$",
      "description": "UTC ISO-8601，统一以 Z 结尾。"
    },
    "dataset_entry": {
      "type": "object",
      "properties": {
        "name": { "type": "string", "description": "数据集名。" },
        "source": {
          "type": "string",
          "description": "来源：题目附件 / 需收集 / 需构造。"
        },
        "fields": {
          "type": "array",
          "items": { "type": "string" },
          "description": "字段清单（含字段含义与单位）。"
        },
        "quality_risks": {
          "type": "array",
          "items": { "type": "string" },
          "description": "该数据集的质量风险（缺失、异常、口径不一等）；无则为空列表。"
        }
      },
      "required": ["name", "source", "fields", "quality_risks"],
      "additionalProperties": false
    },
    "cleaning_status": {
      "type": "string",
      "enum": ["passed", "failed"],
      "description": "清洗沙盒最终采用波的验收结论：passed 断言全过（cleaned/ 有产物且影响面标记行合格）/ failed 到预算仍未过。"
    },
    "cleaning_report": {
      "type": "object",
      "properties": {
        "executed": {
          "type": "boolean",
          "description": "清洗脚本是否真的执行过。false 时 status 为 null、数字为 0、列表为空、reason 说明原因（未配置工具 / 监督者 / 会话端口、无数据文件、预算不足、子代理未完成）。"
        },
        "status": {
          "oneOf": [
            { "type": "null" },
            { "$ref": "#/$defs/cleaning_status" }
          ],
          "description": "最终采用波的验收结论；未执行时为 null。"
        },
        "reason": { "type": "string", "description": "未执行的原因；执行过为空串。" },
        "attempts": { "type": "integer", "minimum": 0, "description": "沙盒波次（首波 + 按审稿意见的修复波）；未执行为 0。" },
        "rows_before": { "type": "integer", "minimum": 0, "description": "清洗前数据行数（脚本标记行 OMM_METRICS_JSON.rows_before）。" },
        "rows_after": { "type": "integer", "minimum": 0, "description": "清洗后数据行数（脚本标记行 rows_after）。" },
        "rows_deleted_ratio": {
          "type": "number",
          "minimum": 0,
          "maximum": 1,
          "description": "删行比例 = 1 − rows_after / rows_before（节点按标记行计算，不信脚本自述）；G2 阈值 0.05。"
        },
        "imputed_columns": {
          "type": "array",
          "items": { "type": "string" },
          "description": "被插补的列（脚本标记行 imputed_columns）；无则空列表。"
        },
        "imputed_target_columns": {
          "type": "array",
          "items": { "type": "string" },
          "description": "被插补的列中属于目标列的部分（大小写不敏感求交）；非空即触发 G2。"
        },
        "summary": { "type": "string", "description": "清洗工程师（沙盒子代理）终答里的一句话自述；未执行为空串。" },
        "review": {
          "oneOf": [
            { "type": "null" },
            { "$ref": "#/$defs/review_report" }
          ],
          "description": "清洗脚本的独立审稿结论（生成者-评审者环：节点确定性复跑核对 + 只读审稿子代理；驳回退修、修不动即僵持交 G2 裁定，僵持时推荐改用原始数据）。首波未过验收、未执行、或审稿环之前的运行时为 null。"
        },
        "outputs": {
          "type": "array",
          "items": { "$ref": "#/$defs/cleaning_output" },
          "description": "清洗产出的文件：cleaned/ 下的清洗后数据表与清洗脚本 cleaning.py（数据准备节点最近一趟登记的产物；投影按产物登记表确定性填，不经模型）。未执行为空列表。可选字段：该字段出现之前的消费者可忽略。"
        },
        "decision": {
          "oneOf": [
            { "type": "null" },
            { "$ref": "#/$defs/cleaning_decision" }
          ],
          "description": "G2 数据确认闸门对这一版清洗的人工决策（采用清洗结果 / 改用原始数据 / 退回调整）。闸门未触发（影响面在阈值内且审稿未僵持）、仍挂起、或未执行清洗时为 null。可选字段：该字段出现之前的消费者可忽略。"
        },
        "figures": {
          "type": "array",
          "items": { "$ref": "#/$defs/data_figure" },
          "description": "清洗沙盒顺手画的探索性图件（清洗前后分布 / 缺失情况等，只画真实数据）：沙盒真实落盘并被采集的图件清单，编号与论文节点的图件清单同一规则（数据准备阶段的图最先编号）。没有图件为空列表。可选字段：该字段出现之前的消费者可忽略。"
        }
      },
      "required": ["executed", "status", "reason", "attempts", "rows_before", "rows_after", "rows_deleted_ratio", "imputed_columns", "imputed_target_columns", "summary", "review"],
      "additionalProperties": false
    },
    "review_verdict": {
      "type": "string",
      "enum": ["accept", "reject"],
      "description": "审稿结论：accept 通过 / reject 驳回（驳回成立须至少一条 blocker，否则节点按 accept 记）。"
    },
    "review_finding": {
      "type": "object",
      "properties": {
        "id": { "type": "string", "description": "意见编号（审稿人给出，缺省按序补 R1、R2…）。" },
        "severity": {
          "type": "string",
          "enum": ["blocker", "major", "minor"],
          "description": "严重度：blocker 会让结果不可信（一票驳回的依据）/ major 应修 / minor 建议。"
        },
        "location": { "type": "string", "description": "问题位置（文件 / 函数 / 行）；无则空串。" },
        "issue": { "type": "string", "description": "问题描述，一句话。" },
        "fix_hint": { "type": "string", "description": "修法建议；无则空串。" }
      },
      "required": ["id", "severity", "location", "issue", "fix_hint"],
      "additionalProperties": false
    },
    "review_report": {
      "type": "object",
      "properties": {
        "executed": {
          "type": "boolean",
          "description": "独立审稿是否真的进行过（至少一轮审稿子代理给出了有效终答）。false 时 verdict 为 null、findings 为空、reason 说明原因（未配置监督者 / 预算不足 / 子代理未完成）。"
        },
        "verdict": {
          "oneOf": [
            { "type": "null" },
            { "$ref": "#/$defs/review_verdict" }
          ],
          "description": "最后一轮审稿人的结论；未执行时为 null。"
        },
        "rounds": { "type": "integer", "minimum": 0, "description": "审稿轮数（含驳回修复后的复审）；未派出过为 0。" },
        "findings": {
          "type": "array",
          "items": { "$ref": "#/$defs/review_finding" },
          "description": "最后一轮审稿意见（blocker 在前、同级保序）；未执行时为空列表。"
        },
        "blockers": { "type": "integer", "minimum": 0, "description": "阻断性意见条数（= findings 中 severity=blocker 的条数）。" },
        "summary": { "type": "string", "description": "审稿人的一句话总结；未执行时为空串。" },
        "stalemate": {
          "type": "boolean",
          "description": "僵持：驳回后修复预算已尽 / 修复波未过验收 / 修复后复审未完成 / 达到轮次上限仍有 blocker。true 时保留最后一波通过验收的结果，交由该阶段的人工闸门（结果采用 / 数据确认）裁定。"
        },
        "rerun_consistent": {
          "type": ["boolean", "null"],
          "description": "节点用同一份最终脚本确定性复跑一次并逐键比对该阶段的关键数字（实验 / 检验：核心指标；清洗：影响面标记行）：true 一致 / false 不一致（可复现性存疑）/ null 未复跑（预算不足或脚本正文缺失）。"
        },
        "reason": {
          "type": "string",
          "description": "未执行或僵持的原因；正常通过时为空串。"
        }
      },
      "required": ["executed", "verdict", "rounds", "findings", "blockers", "summary", "stalemate", "rerun_consistent", "reason"],
      "additionalProperties": false
    },
    "cleaning_output_role": {
      "type": "string",
      "enum": ["cleaned_data", "script", "figure", "other"],
      "description": "产物在清洗里的角色：cleaned_data 清洗后数据表（cleaned/ 下的 table）/ script 清洗脚本（cleaning.py）/ figure 探索性图件（figures/ 下的图）/ other 其余登记产物（日志等）。消费者须容忍新增取值。"
    },
    "cleaning_output": {
      "type": "object",
      "properties": {
        "artifact_id": { "type": "string", "description": "产物 id（/api/v1/artifacts/{id}/download 的主键）。" },
        "name": { "type": "string", "description": "文件名（内容 URI 尾部的真实文件名）。" },
        "role": { "$ref": "#/$defs/cleaning_output_role" },
        "media_type": { "type": "string", "description": "登记的媒体类型；未知为 application/octet-stream。" },
        "size_bytes": { "type": ["integer", "null"], "minimum": 0, "description": "登记大小；未知为 null。" },
        "sha256": {
          "type": ["string", "null"],
          "pattern": "^[0-9a-f]{64}$",
          "description": "登记的内容摘要（下载端点按同一值核验）；未登记为 null。"
        },
        "download_url": {
          "type": ["string", "null"],
          "description": "可下载时的相对地址（/api/v1/artifacts/{id}/download）；内容对象缺失或产物未就绪为 null。"
        }
      },
      "required": ["artifact_id", "name", "role", "media_type", "size_bytes", "sha256", "download_url"],
      "additionalProperties": false
    },
    "cleaning_decision": {
      "type": "object",
      "properties": {
        "approval_id": { "type": "string", "description": "G2 审批请求 id（/task-runs/{run_id}/approvals 里的那条）。" },
        "option_id": {
          "type": "string",
          "description": "所选选项 id：adopt_cleaned 采用清洗结果 / use_raw 改用原始数据 / reject 退回调整（节点声明的选项，消费者须容忍新增取值）。"
        },
        "actor": { "type": "string", "description": "拍板人（账户标识原值；无登录信息时为 user）。" },
        "comment": { "type": ["string", "null"], "description": "拍板时的备注；无则 null。" },
        "resolved_at": { "$ref": "#/$defs/timestamp" }
      },
      "required": ["approval_id", "option_id", "actor", "comment", "resolved_at"],
      "additionalProperties": false
    },
    "data_input": {
      "type": "object",
      "properties": {
        "artifact_id": { "type": "string", "description": "附件产物 id（/api/v1/artifacts/{id}/download 与 /preview 的主键）。" },
        "name": { "type": "string", "description": "文件名（运行参数里登记的名字，取 basename）。" },
        "media_type": { "type": "string", "description": "登记的媒体类型；产物不在登记表时为 application/octet-stream。" },
        "size_bytes": { "type": ["integer", "null"], "minimum": 0, "description": "登记大小；未知为 null。" },
        "sha256": {
          "type": ["string", "null"],
          "pattern": "^[0-9a-f]{64}$",
          "description": "登记的内容摘要；未登记为 null。"
        },
        "download_url": {
          "type": ["string", "null"],
          "description": "可下载时的相对地址（/api/v1/artifacts/{id}/download）；产物缺失、不属于本项目或内容对象不可读为 null。"
        },
        "staged": {
          "type": "boolean",
          "description": "是否满足下发到沙盒工作区 data/ 的条件（.csv 文件、同项目产物、≤ 10 MB）——不满足的附件数据阶段看不到，只作附件摘要。"
        }
      },
      "required": ["artifact_id", "name", "media_type", "size_bytes", "sha256", "download_url", "staged"],
      "additionalProperties": false
    },
    "data_figure_stage": {
      "type": "string",
      "enum": ["DATA_PREPARATION"],
      "description": "图件的来源阶段：数据准备（清洗沙盒的探索性图）。"
    },
    "data_figure": {
      "type": "object",
      "properties": {
        "number": { "type": "integer", "minimum": 1, "description": "全文统一编号「图 N」（数据准备阶段的图最先编号，与实验 / 检验 / 论文补图同一张清单）。" },
        "name": { "type": "string", "description": "图件文件名（basename）。" },
        "artifact_id": {
          "type": ["string", "null"],
          "description": "图件产物 id（/api/v1/artifacts/{id}/download 可取图）；未登记为 null，消费者不得拼下载链接。"
        },
        "caption": { "type": "string", "description": "清洗工程师在终答 figure_notes 里给的一句说明；未给为空串。" },
        "source_stage": { "$ref": "#/$defs/data_figure_stage" }
      },
      "required": ["number", "name", "artifact_id", "caption", "source_stage"],
      "additionalProperties": false
    }
  }
}
