{
  "run_id": "run_1a2b3c4d5e6f708192a3b4c5d6e7f809",
  "profile_summary": "两张附件表共 1,200 行，缺失集中在 demand 列（8%），存在少量负值异常，清洗后可建模。",
  "datasets": [
    {
      "name": "历史订单",
      "source": "题目附件",
      "fields": ["hour 时段", "region 区域", "demand 需求量（次）"],
      "quality_risks": ["demand 缺失 8%", "个别 demand 为负值"]
    },
    {
      "name": "站点信息",
      "source": "题目附件",
      "fields": ["region 区域", "docks 投放点数（个）"],
      "quality_risks": []
    }
  ],
  "preparation_steps": ["按 region 合并两表", "demand 缺失按区域中位数插补", "删除 demand 为负的行"],
  "missing_value_strategy": "demand 缺失按同区域同时段中位数插补，其余列不插补",
  "outlier_strategy": "demand 为负视为录入错误直接删行",
  "derived_features": ["是否高峰时段"],
  "cleaning": {
    "executed": true,
    "status": "passed",
    "reason": "",
    "attempts": 2,
    "rows_before": 1200,
    "rows_after": 1104,
    "rows_deleted_ratio": 0.08,
    "imputed_columns": ["demand"],
    "imputed_target_columns": ["demand"],
    "summary": "合并两表后按区域中位数插补 demand，删除 96 行负值记录",
    "review": {
      "executed": true,
      "verdict": "reject",
      "rounds": 2,
      "findings": [
        {
          "id": "R1",
          "severity": "blocker",
          "location": "cleaning.py:impute()",
          "issue": "目标列 demand 被插补，方案只允许对特征列插补",
          "fix_hint": "demand 缺失行改为删除或标记，不得插补目标列"
        },
        {
          "id": "R2",
          "severity": "minor",
          "location": "",
          "issue": "删行数写死在打印语句里而非由 DataFrame 长度算出",
          "fix_hint": "rows_after 用 len(df) 计算"
        }
      ],
      "blockers": 1,
      "summary": "目标列被越权插补，清洗产物不能作为建模样本",
      "stalemate": true,
      "rerun_consistent": true,
      "reason": "审稿 2 轮后仍有阻断性意见未解决"
    },
    "outputs": [
      {
        "artifact_id": "art_c1e2a3d4b5f60718",
        "name": "orders.csv",
        "role": "cleaned_data",
        "media_type": "text/csv",
        "size_bytes": 48211,
        "sha256": "9b3f0c2a6d5e4f7183920a1b2c3d4e5f6a7b8c9d0e1f2a3b4c5d6e7f8091a2b3",
        "download_url": "/api/v1/artifacts/art_c1e2a3d4b5f60718/download"
      },
      {
        "artifact_id": "art_c1e2a3d4b5f60719",
        "name": "stations.csv",
        "role": "cleaned_data",
        "media_type": "text/csv",
        "size_bytes": 3120,
        "sha256": null,
        "download_url": null
      },
      {
        "artifact_id": "art_c1e2a3d4b5f6071a",
        "name": "cleaning.py",
        "role": "script",
        "media_type": "text/x-python",
        "size_bytes": 2048,
        "sha256": "1c2d3e4f5a6b7c8d9e0f1a2b3c4d5e6f7a8b9c0d1e2f3a4b5c6d7e8f9a0b1c2d",
        "download_url": "/api/v1/artifacts/art_c1e2a3d4b5f6071a/download"
      }
    ],
    "decision": {
      "approval_id": "apr_7d8e9f0a1b2c3d4e",
      "option_id": "use_raw",
      "actor": "user",
      "comment": "审稿僵持，先用原始数据建模",
      "resolved_at": "2026-09-06T12:05:00.000000Z"
    }
  },
  "updated_at": "2026-09-06T12:00:00.000000Z"
}
